{
  "schema_version": "cognicode.platforms/v1",
  "product": "cognicode",
  "version": "0.101.23",
  "source_commit": "4e1821f534b443328f1f4e4299731af09174b1a1",
  "platforms": [
    {
      "id": "linux-aarch64",
      "target": "aarch64-unknown-linux-gnu",
      "name": "Linux Aarch64",
      "support_level": "experimental",
      "evidence": [
        "Not built by release-candidate.pipeline.kts (no entry in `val targets`)",
        "TF-6/TF-7 track the CI runner provisioning and the cross toolchain"
      ]
    },
    {
      "id": "linux-x86-64",
      "target": "x86_64-unknown-linux-gnu",
      "name": "Linux X86 64",
      "support_level": "certified",
      "evidence": [
        "Native publishable lane in release-candidate.pipeline.kts",
        "Certified by release-candidate.pipeline.kts and published unchanged by release.pipeline.kts"
      ]
    },
    {
      "id": "linux-x86-64-musl",
      "target": "x86_64-unknown-linux-musl",
      "name": "Linux x86_64 musl",
      "support_level": "experimental",
      "evidence": [
        "Smoke build in integration.pipeline.kts",
        "No publishable release lane in release-candidate.pipeline.kts"
      ]
    },
    {
      "id": "macos-arm64",
      "target": "aarch64-apple-darwin",
      "name": "macOS arm64",
      "support_level": "unsupported",
      "evidence": [
        "Not built by release-candidate.pipeline.kts (no entry in `val targets`)",
        "A-027 tracks macOS arm64 build/certification"
      ]
    },
    {
      "id": "macos-x86-64",
      "target": "x86_64-apple-darwin",
      "name": "macOS x86_64",
      "support_level": "unsupported",
      "evidence": [
        "Not built by release-candidate.pipeline.kts (no entry in `val targets`)",
        "A-027 tracks macOS build/certification"
      ]
    },
    {
      "id": "windows-x86-64",
      "target": "x86_64-pc-windows-msvc",
      "name": "Windows x86_64",
      "support_level": "unsupported",
      "evidence": [
        "Not built by release-candidate.pipeline.kts (no entry in `val targets`)",
        "A-028 tracks Windows x64 build/certification"
      ]
    }
  ]
}
